{
  "manifest_version": "4.0",
  "generated_at": "2026-08-03T00:00:00Z",
  "producer": "twin2multicloud_backend",
  "package": {
    "format": "deployer-project-zip",
    "files": [
      "config.json",
      "config_credentials.json",
      "config_events.json",
      "config_iot_devices.json",
      "config_providers.json"
    ],
    "required_files": [
      "config.json",
      "config_iot_devices.json",
      "config_events.json",
      "config_credentials.json",
      "config_providers.json"
    ],
    "secret_bearing_files": [
      "config_credentials.json"
    ]
  },
  "twin": {
    "id": null,
    "name": "Five-layer v2 single-cloud-aws-small",
    "resource_name": "five-layer-v2-single-cloud-aws-small"
  },
  "providers": {
    "layer_3_archive_provider": "aws",
    "layer_3_cold_provider": "aws",
    "layer_3_hot_provider": "aws",
    "layer_1_provider": "aws",
    "layer_2_provider": "aws",
    "layer_4_provider": "aws",
    "layer_5_provider": "aws"
  },
  "calculation_run_id": "420bd4ff-8700-5034-8313-334244c0d0b1",
  "resolved_twin_architecture_digest": "sha256:f30f6268ec5866cd3e97d4996c06c82f7b3279938cd6aa1b49acae7fee9eaddc",
  "resolved_twin_architecture": {
    "schema_version": "resolved-twin-architecture.v2",
    "resolution_status": "offline_contract_fixture",
    "resolution_id": "90fa0643-b202-5243-a2c9-e98bcc73b9fc",
    "calculation_run_id": "420bd4ff-8700-5034-8313-334244c0d0b1",
    "architecture_profile_ref": {
      "id": "five-layer-baseline",
      "version": "2",
      "digest": "sha256:0d7f87bda7703bd71ac16081f96ecab1a8777d6aa49bc52cb94c83906a11b16a"
    },
    "optimization_bundle_ref": {
      "optimization_strategy_id": "cost-minimization-v2",
      "optimization_strategy_version": "2",
      "calculation_strategy_id": "profile-resolution-v2",
      "calculation_strategy_version": "2",
      "formula_set_id": "phase-08-complete-service-bundles",
      "formula_set_version": "1",
      "scoring_strategy_id": "profile-local-min-total-cost-v2",
      "scoring_strategy_version": "2",
      "compatibility_digest": "sha256:a0c39dcae6c95c2cb25251389c6569a0f5ea4428a0403ccc4cf934541cda06f1"
    },
    "provider_profile_refs": [
      {
        "id": "provider-profile.aws.five-layer-baseline-v2",
        "version": "1",
        "digest": "sha256:69e9ca0247d42dd2098e3c99774a8a80bafd842aff3dc3e486a97f40df2651d5",
        "provider": "aws"
      }
    ],
    "workload_contract_ref": {
      "id": "five-layer-workload",
      "version": "2",
      "digest": "sha256:62117c5bfe4d0951be57f00ba281e1c5212db68a72cc49c0413c45a29f65711e"
    },
    "pricing_evidence_refs": [
      {
        "id": "pricing-evidence.aws.phase-08-v2",
        "version": "1",
        "digest": "sha256:274a7463a18f18839bcd8f78b7ac3a04451bdd7cde54e418f3775fca4ef982fa",
        "provider": "aws",
        "currency": "USD"
      }
    ],
    "component_assignments": [
      {
        "assignment_id": "assignment.archive-storage",
        "responsibility_id": "responsibility.storage",
        "logical_component_id": "component.archive-storage",
        "provider": "aws",
        "provider_implementation_profile_ref": {
          "id": "provider-profile.aws.five-layer-baseline-v2",
          "version": "1",
          "digest": "sha256:69e9ca0247d42dd2098e3c99774a8a80bafd842aff3dc3e486a97f40df2651d5"
        },
        "deployment_component_id": "deployment.aws.archive-storage.v2",
        "deployment_component_version": "1",
        "service_id": "aws.archive-storage.v2",
        "region": "eu-central-1",
        "capability_evidence": [
          "capability.archive-storage"
        ],
        "pricing_model_refs": [
          "pricing.aws.archive-storage.v2"
        ],
        "formula_refs": [
          "formula.phase-08-complete-service-bundles"
        ],
        "deployment_specification_component_ids": [
          "aws.s3-glacier-deep-archive"
        ],
        "cost_contribution": {
          "currency": "USD",
          "monthly_amount": "0"
        },
        "required": true
      },
      {
        "assignment_id": "assignment.cool-storage",
        "responsibility_id": "responsibility.storage",
        "logical_component_id": "component.cool-storage",
        "provider": "aws",
        "provider_implementation_profile_ref": {
          "id": "provider-profile.aws.five-layer-baseline-v2",
          "version": "1",
          "digest": "sha256:69e9ca0247d42dd2098e3c99774a8a80bafd842aff3dc3e486a97f40df2651d5"
        },
        "deployment_component_id": "deployment.aws.cool-storage.v2",
        "deployment_component_version": "1",
        "service_id": "aws.cool-storage.v2",
        "region": "eu-central-1",
        "capability_evidence": [
          "capability.cool-storage"
        ],
        "pricing_model_refs": [
          "pricing.aws.cool-storage.v2"
        ],
        "formula_refs": [
          "formula.phase-08-complete-service-bundles"
        ],
        "deployment_specification_component_ids": [
          "aws.s3-standard-ia"
        ],
        "cost_contribution": {
          "currency": "USD",
          "monthly_amount": "0"
        },
        "required": true
      },
      {
        "assignment_id": "assignment.hot-storage",
        "responsibility_id": "responsibility.storage",
        "logical_component_id": "component.hot-storage",
        "provider": "aws",
        "provider_implementation_profile_ref": {
          "id": "provider-profile.aws.five-layer-baseline-v2",
          "version": "1",
          "digest": "sha256:69e9ca0247d42dd2098e3c99774a8a80bafd842aff3dc3e486a97f40df2651d5"
        },
        "deployment_component_id": "deployment.aws.hot-storage.v2",
        "deployment_component_version": "1",
        "service_id": "aws.hot-storage.v2",
        "region": "eu-central-1",
        "capability_evidence": [
          "capability.hot-storage"
        ],
        "pricing_model_refs": [
          "pricing.aws.hot-storage.v2"
        ],
        "formula_refs": [
          "formula.phase-08-complete-service-bundles"
        ],
        "deployment_specification_component_ids": [
          "aws.dynamodb-on-demand-raw",
          "aws.dynamodb-on-demand-hourly-rollup",
          "aws.eventbridge-scheduler",
          "aws.ecs-fargate-storage-mover",
          "aws.ecr-if-container-selected"
        ],
        "cost_contribution": {
          "currency": "USD",
          "monthly_amount": "0"
        },
        "required": true
      },
      {
        "assignment_id": "assignment.ingestion",
        "responsibility_id": "responsibility.ingestion",
        "logical_component_id": "component.ingestion",
        "provider": "aws",
        "provider_implementation_profile_ref": {
          "id": "provider-profile.aws.five-layer-baseline-v2",
          "version": "1",
          "digest": "sha256:69e9ca0247d42dd2098e3c99774a8a80bafd842aff3dc3e486a97f40df2651d5"
        },
        "deployment_component_id": "deployment.aws.ingestion.v2",
        "deployment_component_version": "1",
        "service_id": "aws.ingestion.v2",
        "region": "eu-central-1",
        "capability_evidence": [
          "capability.ingestion",
          "capability.embedded-domain-event-ingress"
        ],
        "pricing_model_refs": [
          "pricing.aws.ingestion.v2"
        ],
        "formula_refs": [
          "formula.phase-08-complete-service-bundles"
        ],
        "deployment_specification_component_ids": [
          "aws.iot-core",
          "aws.iot-commands",
          "aws.sqs-fifo",
          "aws.lambda-event-adapter",
          "aws.cloudwatch"
        ],
        "cost_contribution": {
          "currency": "USD",
          "monthly_amount": "0"
        },
        "required": true
      },
      {
        "assignment_id": "assignment.processing",
        "responsibility_id": "responsibility.processing",
        "logical_component_id": "component.processing",
        "provider": "aws",
        "provider_implementation_profile_ref": {
          "id": "provider-profile.aws.five-layer-baseline-v2",
          "version": "1",
          "digest": "sha256:69e9ca0247d42dd2098e3c99774a8a80bafd842aff3dc3e486a97f40df2651d5"
        },
        "deployment_component_id": "deployment.aws.processing.v2",
        "deployment_component_version": "1",
        "service_id": "aws.processing.v2",
        "region": "eu-central-1",
        "capability_evidence": [
          "capability.processing",
          "capability.embedded-domain-event-routing",
          "capability.mandatory-rule-action-feedback"
        ],
        "pricing_model_refs": [
          "pricing.aws.processing.v2"
        ],
        "formula_refs": [
          "formula.phase-08-complete-service-bundles"
        ],
        "deployment_specification_component_ids": [
          "aws.lambda",
          "aws.step-functions-standard"
        ],
        "cost_contribution": {
          "currency": "USD",
          "monthly_amount": "0"
        },
        "required": true
      },
      {
        "assignment_id": "assignment.twin-state",
        "responsibility_id": "responsibility.twin-state",
        "logical_component_id": "component.twin-state",
        "provider": "aws",
        "provider_implementation_profile_ref": {
          "id": "provider-profile.aws.five-layer-baseline-v2",
          "version": "1",
          "digest": "sha256:69e9ca0247d42dd2098e3c99774a8a80bafd842aff3dc3e486a97f40df2651d5"
        },
        "deployment_component_id": "deployment.aws.twin-state.v2",
        "deployment_component_version": "1",
        "service_id": "aws.twin-state.v2",
        "region": "eu-central-1",
        "capability_evidence": [
          "capability.twin-state"
        ],
        "pricing_model_refs": [
          "pricing.aws.twin-state.v2"
        ],
        "formula_refs": [
          "formula.phase-08-complete-service-bundles"
        ],
        "deployment_specification_component_ids": [
          "aws.iot-twinmaker-standard",